"DESCRIPTION","DURATION IN MS","NAME","PARENT SUITE","START TIME","STATUS","STOP TIME","SUB SUITE","SUITE","TEST CLASS","TEST METHOD"
"","3000","ONEVIEW-729: Verify Edit Mode info banner exact content and close action @regression","Phase-2","Tue May 05 14:38:58 IST 2026","passed","Tue May 05 14:39:01 IST 2026","","Phase-2 Regression","",""
"","3000","ONEVIEW-755: Verify drawer reflects real-time layout changes @regression","Phase-2","Tue May 05 14:36:23 IST 2026","passed","Tue May 05 14:36:26 IST 2026","","Phase-2 Regression","",""
"","3000","ONEVIEW-758: Verify drawer auto-closes on exiting Edit Mode @regression","Phase-2","Tue May 05 14:36:38 IST 2026","passed","Tue May 05 14:36:41 IST 2026","","Phase-2 Regression","",""
"","3000","ONEVIEW-798: Verify removing all configurable cards leaves only fixed cards @regression","Phase-2","Tue May 05 14:43:33 IST 2026","passed","Tue May 05 14:43:36 IST 2026","","Phase-2 Regression","",""
"","3000","ONEVIEW-772: Verify card appears in dashboard layout on Add click @regression","Phase-2","Tue May 05 14:33:58 IST 2026","passed","Tue May 05 14:34:01 IST 2026","","Phase-2 Regression","",""
"","3000","ONEVIEW-767: Verify card selection panel opens on Add Cards click @regression","Phase-2","Tue May 05 14:33:33 IST 2026","passed","Tue May 05 14:33:36 IST 2026","","Add Cards","",""
"","3000","ONEVIEW-803: Verify Remove button typography and color consistency @regression","Phase-2","Tue May 05 14:43:58 IST 2026","passed","Tue May 05 14:44:01 IST 2026","","Remove Cards","",""
"","3000","ONEVIEW-724: Verify empty column visual state in Edit Mode @regression","Phase-2","Tue May 05 14:38:33 IST 2026","passed","Tue May 05 14:38:36 IST 2026","","Phase-2 Regression","",""
"","3000","ONEVIEW-819: Verify close (×) icon on Save confirmation popup dismisses without saving @regression","Phase-2","Tue May 05 14:40:48 IST 2026","passed","Tue May 05 14:40:51 IST 2026","","Phase-2 Regression","",""
"","3000","ONEVIEW-771: Verify Add button default state styling @regression","Phase-2","Tue May 05 14:33:53 IST 2026","passed","Tue May 05 14:33:56 IST 2026","","Phase-2 Regression","",""
"","3000","ONEVIEW-730: Verify Add Cards drawer search bar UI @regression","Phase-2","Tue May 05 14:39:03 IST 2026","passed","Tue May 05 14:39:06 IST 2026","","Add Cards","",""
"","3000","ONEVIEW-775: Verify duplicate addition is prevented visually @regression","Phase-2","Tue May 05 14:34:13 IST 2026","passed","Tue May 05 14:34:16 IST 2026","","Phase-2 Regression","",""
"","3000","ONEVIEW-801: Verify drag handle is removed when card is removed @regression","Phase-2","Tue May 05 14:43:48 IST 2026","passed","Tue May 05 14:43:51 IST 2026","","Drag and Drop","",""
"","3000","ONEVIEW-714: Verify column dividers visibility in multi-column layouts @regression","Phase-2","Tue May 05 14:37:43 IST 2026","passed","Tue May 05 14:37:46 IST 2026","","Phase-2 Regression","",""
"","3000","ONEVIEW-823: Verify Default Layout is applied on Restore Default confirmation @regression","Phase-2","Tue May 05 14:41:08 IST 2026","passed","Tue May 05 14:41:11 IST 2026","","Phase-2 Regression","",""
"","3000","ONEVIEW-812: Verify Cancel on Save confirmation does not save layout @smoke","Phase-2","Tue May 05 14:45:33 IST 2026","passed","Tue May 05 14:45:36 IST 2026","","Phase-2 Regression","",""
"","3000","ONEVIEW-809: Verify Restore Default Layout option and confirmation @smoke","Phase-2","Tue May 05 14:45:18 IST 2026","passed","Tue May 05 14:45:21 IST 2026","","Phase-2 Regression","",""
"","3000","ONEVIEW-761: Verify card icons and visual identity in drawer @regression","Phase-2","Tue May 05 14:36:53 IST 2026","passed","Tue May 05 14:36:56 IST 2026","","Phase-2 Regression","",""
"","3000","ONEVIEW-793: Verify multiple cards can be removed sequentially @regression","Phase-2","Tue May 05 14:43:08 IST 2026","passed","Tue May 05 14:43:11 IST 2026","","Phase-2 Regression","",""
"","3000","ONEVIEW-774: Verify Remove button state styling after Add @regression","Phase-2","Tue May 05 14:34:08 IST 2026","passed","Tue May 05 14:34:11 IST 2026","","Remove Cards","",""
"","3000","ONEVIEW-850: Verify Add button adds a card to the dashboard layout @smoke","Phase-2","Tue May 05 14:44:08 IST 2026","passed","Tue May 05 14:44:11 IST 2026","","Phase-2 Regression","",""
